{
  "pilotId": "live-pilot:microsoft-graph-direct-grant-revocation",
  "environment": "pilot_candidate",
  "generatedAt": "2026-05-26T00:00:00.000Z",
  "connector": {
    "connectorId": "microsoft-graph-live-revocation",
    "provider": "microsoft-graph",
    "tenantBoundary": "tenant:pilot-redacted",
    "mode": "enforcement",
    "liveWritesOptIn": true,
    "allowedWriteScopes": ["GroupMember.ReadWrite.All"],
    "forbiddenWriteScopes": [
      "Directory.ReadWrite.All",
      "Files.ReadWrite.All",
      "RoleManagement.ReadWrite.Directory",
      "Sites.FullControl.All",
      "User.ReadWrite.All"
    ],
    "leastPrivilegeReviewRef": "deploy/live-enforcement-pilot/evidence/least-privilege-review.example.json"
  },
  "writePath": {
    "operation": "revoke_native_grant",
    "scope": "single_resource_direct_grant",
    "resourceRisk": "moderate",
    "maxActionsPerChange": 1,
    "revocationPriority": "emergency"
  },
  "readOnlyConfidence": {
    "minSuccessfulRuns": 3,
    "successfulRuns": 3,
    "maxEvidenceAgeHours": 24,
    "evidenceAgeHours": 4,
    "nativeReadbackVerified": true,
    "driftFindingsReviewed": true,
    "evidenceRefs": ["deploy/live-enforcement-pilot/evidence/read-only-confidence.example.json"]
  },
  "approvalWorkflow": {
    "requiredApproverRoles": ["resource-owner", "security-engineer"],
    "minApprovers": 2,
    "separationOfDuties": true,
    "changeTicketPattern": "^chg:live-pilot:[a-z0-9_:-]+$",
    "approvalExpiresMinutes": 30,
    "breakGlassProhibited": true,
    "incidentModeBlocksEnforcement": true,
    "evidenceRef": "deploy/live-enforcement-pilot/evidence/approval-workflow.example.json"
  },
  "runtimeGates": {
    "connectorHealth": "healthy",
    "auditHealth": "healthy",
    "durableQueueRequired": true,
    "immutableAuditRequired": true,
    "adminAuthorizationRequired": true,
    "healthSignalsRequired": true,
    "degradedConnectorBlocksEnforcement": true,
    "degradedAuditBlocksEnforcement": true,
    "revocationsPrioritized": true,
    "idempotencyRequired": true,
    "readinessReportRequired": true,
    "evidenceRefs": ["deploy/live-enforcement-pilot/evidence/runtime-gates.example.json"]
  },
  "verification": {
    "dryRunFirst": true,
    "preWriteReadback": true,
    "postWriteReadback": true,
    "compensationRequired": true,
    "rollbackPlanRef": "runbooks/policy-rollback.md",
    "driftReconciliationRequired": true,
    "auditEventTypes": [
      "connector.enforcement_readiness_checked",
      "provisioning.approved",
      "connector.permission_changed",
      "provisioning.rollback_available",
      "drift.finding_reviewed"
    ],
    "evidenceRefs": ["deploy/live-enforcement-pilot/evidence/verification-rollback.example.json"]
  },
  "runbookRefs": [
    "runbooks/emergency-revocation.md",
    "runbooks/connector-outage.md",
    "runbooks/decision-api-outage.md",
    "runbooks/policy-rollback.md"
  ],
  "releaseGate": {
    "status": "ready",
    "readinessReportRef": "deploy/live-enforcement-pilot/readiness-report.example.json",
    "releaseApprovalRef": "deploy/live-enforcement-pilot/evidence/release-approval.example.json",
    "outstandingBlockers": []
  },
  "evidenceRefs": [
    "deploy/live-enforcement-pilot/evidence/least-privilege-review.example.json",
    "deploy/live-enforcement-pilot/evidence/read-only-confidence.example.json",
    "deploy/live-enforcement-pilot/evidence/approval-workflow.example.json",
    "deploy/live-enforcement-pilot/evidence/runtime-gates.example.json",
    "deploy/live-enforcement-pilot/evidence/verification-rollback.example.json",
    "deploy/live-enforcement-pilot/evidence/release-approval.example.json"
  ],
  "version": "live-enforcement-pilot-manifest:v1"
}
